{
  "$schema": "https://json-schema.org/draft/2020-12/schema",
  "$id": "https://nullhorizon.local/schema/signal.schema.json",
  "title": "Signal",
  "type": "object",
  "additionalProperties": false,
  "required": ["schema_version", "signal_id", "title", "fragments"],
  "properties": {
    "schema_version": { "type": "integer", "const": 1 },
    "signal_id": {
      "type": "string",
      "pattern": "^[a-z0-9_]+(\\.[a-z0-9_]+)+$"
    },
    "title": { "type": "string", "minLength": 1 },
    "description": { "type": "string" },
    "fragments": {
      "type": "array",
      "minItems": 1,
      "items": { "type": "string", "minLength": 1 }
    }
  }
}
